,About,Category,Count,Last Appeared,Organizations,Technology,Topics
176,Supporting community development of visionary Earth science data technology.,Science and Medicine,1,2019,Earth Science Information Partners,"python, kubernetes, jupyter, deep learning, gdal","earth observation, cloud databases,  data visualisation, semantic web, data-science"
177,Making Earth science data matter.,Data and Databases,1,2018,Earth Science Information Partners (ESIP)," kubernetes,  dask,  xarray,  python, javascript","earth data, semantics, discovery, data visualization, earth science"
178,Eclipse is a community who collaborates on open source software.,Programming Languages and Development Tools,3,2016,Eclipse Foundation,"java, geospatial, c/c++","java, eclipse"
179,Eclipse Vert.x is a tool-kit for building reactive applications on the JVM,Programming Languages and Development Tools,1,2017,Eclipse Vert.x,"java, reactive extensions, kotlin, microservices, event-loop","reactive, unopionated, polyglot, distributed, high performance computing"
180,,,1,2011,"Ecole Polytechnique Federale de Lausanne, Scala Team",,
181,"We are the creators of Elasticsearch, Kibana, Beats, and Logstash.",Data and Databases,2,2018,Elastic," java, golang, node.js, react, jruby","data analytics, data visualization, monitoring, search, logging"
182,,,2,2011,Electronic Frontier Foundation/The Tor Project,,
183,,,1,2011,Elgg,,
184,A delightful functional language for reliable webapps.,Programming Languages and Development Tools,1,2017,Elm Software Foundation,"elm, javascript, haskell","functional programming, compilers, web applications, programming languages, user interface"
185,Modular and configurable OS for embedded applications,Operating Systems,1,2020,Embox,"c, gcc,  assembly"," embedded systems, rtos"
186,,,1,2015,Encyclopedia of Life,,
187,International network addressing threats to US environmental & energy policy,Data and Databases,1,2017,Environmental Data And Governance Initiative,"python, javascript, ruby on rails, google cloud, go","crawling, api, open data, machine learning, open science"
188,Supporting the Beam community,Programming Languages and Development Tools,1,2020,Erlang Ecosystem Foundation,"erlang, elixir, lfe, beam","language, soft real-time,  distributed systems, messaging, instant messaging"
189,,,1,2009,ES Operating System,,
190,,,2,2012,ESUG (European Smalltalk User Group),,
191,Eta is a dialect of Haskell on the Java Virtual Machine.,Programming Languages and Development Tools,1,2018,Eta,"haskell, jvm,  java","functional-programming, runtime systems, compilers, programming-tools"
192,,,3,2009,Etherboot Project,,
193,,,1,2010,European Smalltalk User Group (ESUG),,
194,,,1,2010,"European Space Agency, The Advanced Concepts Team",,
195,,,1,2012,Evergreen,,
196,,,1,2011,Evergreen Project,,
197,,,1,2010,Expert Labs,,
198,,,1,2010,Facebook,,
199,Lead the advance of Free/Open Source Software/Content as collaborative community,Operating Systems,5,2016,Fedora Project,"python, flask, postgresql, html5, javascript","web development, metrics, realtime messaging, contributor activity, community architecture"
200,,,1,2009,Fedora Project & JBoss.org (Red Hat),,
201,Cross-platform software to convert audio and video.,Graphics / Video / Audio / Virtual Reality,8,2016,FFmpeg,"c, asm, git","audio, video, image, compression, multimedia"
202,,,1,2011,FFmpeg / Libav,,
203,,,1,2011,FiberCorps,,
204,,,1,2009,Fiji,,
205,,,1,2014,Flowgrammable,,
206,,,1,2011,fluxbox,,
207,,,1,2012,Formal Systems Laboratory at UIUC,,
208,The organization that handles all aspects of the FOSDEM conference,Programming Languages and Development Tools,2,2017,FOSDEM,"git, ruby on rails, postgresql, html/css","web, programming tools, programming languages, ruby, rails"
209,The organization that handles all aspects of the FOSDEM conference,Programming Languages and Development Tools,1,2016,FOSDEM VZW,"ruby on rails, postgresql, git","web, programming tools, programming, programming languages, ruby"
210,Open Technologies for Social Change,,8,2016,FOSSASIA,"javascript, android, python, java, json api","web, mobile, graphics, fashiontech, json"
211,Open Source License Compliance by Open Source Software,Other,2,2018,FOSSology,"php, postgresql, lamp, linux, c/c++","licensing, open source, license compliance, compliance, spdx"
212,FOSSology is an open source license compliance software system and toolkit.,Other,1,2019,FOSSology Project,"postgresql, php,  c/c++, jquery, bash","compliance, license-scan, oss licensing, spdx, oss compliance"
213,,,1,2015,Foundation for Learning Equality,,
214,Natural Language Understanding with structured computational semantics,Data and Databases,1,2020,FrameNet Brasil (UFJF),"php, mysql,  javascript,  python","natural language processing, natural language understanding, multimodality,  video processing, multilinguality"
215,Natural Language Understanding with structured computational semantics,Data and Databases,1,2019,FrameNet Brasil at the Federal University of Juiz de Fora,"php, mysql, javascript,  python","natural language processing, multimodality, natural language understanding, image processing, machine translation"
216,"Free and Open Source Digital Designs and their Ecosystem, EDA Tools and OpenRISC",,5,2016,Free and Open Source Silicon Foundation,"open hardware, fpga, compiler, python, javascript","digital design, compilers, eda tools, debug, embedded systems"
217,FreeBSD: The Foundation of the Internet,Operating Systems,9,2016,FreeBSD,"c/c++, clang, llvm, shell script, make","virtualization, embeddded, kernel, cloud, security"
218,FreeBSD: The Foundation of the Internet,Operating Systems,1,2020,FreeBSD Project,"c/c++, llvm, shell script, assembly, make","operating systems, virtualization, kernel, cloud, embedded systems"
219,,,2,2010,FreedroidRPG,,
220,,,5,2010,Freenet Project Inc,,
221,,,1,2012,Freeseer recording and streaming suite,,
222,,,1,2011,Freeseer video recording and streaming suite,,
223,,,1,2009,Free Software Initiative of Japan,,
224,A software library to render fonts.,Graphics / Video / Audio / Virtual Reality,3,2018,FreeType,"c, gnu make, gnu autotools, python, fonts","fonts, truetype, opentype, graphics, rendering"
225,Human transcription of family history data,Data and Databases,1,2018,Free UK Genealogy,"mongodb, ruby on rails, mysql, python,  css/html","ai, machine learning,  ui/ux,  web apps, open data"
226,Freifunk is a non-commercial initiative for free and open wireless networks.,Social / Communications,9,2016,Freifunk,"openwrt, olsr, batman, c, lua","mesh, wifi, routing protocols, user interface, monitoring"
227,,,1,2014,Frenetic,,
228,Edit music scores with GNU LilyPond.,End User Applications,1,2017,Frescobaldi,"python, pyqt",music engraving
229,"Routing suite for *nix platforms including BGP, IS-IS, LDP, OSPF, PIM, and RIP.",Other,1,2020,FRRouting,"c, linux, linux kernel, networking,  lua"," networking, software defined networking, linux, performance, systems programming"
230,,,1,2013,Funf.org,,
231,Software for Analysis of Game Theory Models,Science and Medicine,1,2016,Gambit - Software Tools for Game Theory,javascript,"game theory, academic projects, graphics"
232,,,1,2014,Gambit: Software Tools for Game Theory,,
233,Cluster virtual server management software,,4,2016,Ganeti,"python, haskell, kvm, xen, virtualization","virtualization, automation"
234,,,1,2014,Ganglia,,
235,,,1,2009,GCC,,
236,,,2,2010,"GCC, the GNU Compiler Collection",,
237,,,4,2012,GCC - GNU Compiler Collection,,
238,The cross-platform game engine designed for everyone.,Programming Languages and Development Tools,1,2020,GDevelop,"javascript, c/c++, web development, game development, react","gaming, graphics, web applications,  web, compilers"
239,,,2,2009,Geeklog,,
240,Ensembl Genome Browsers,Science and Medicine,4,2016,"Genes, Genomes and Variation","mysql, javascript, perl","bioinformatics, databases, data visualisation, web platform and services"
241,Developing open software for IVI and the connected car.,Operating Systems,2,2018,GENIVI Alliance,"yocto, c/c++, java","automotive, diagnostics, functional safety, middleware"
242,Open Source Automotive Development Platform,Programming Languages and Development Tools,1,2017,GENIVI Development Platform,"linux, c, yocto, c++, qt","automotive, cars, embedded systems, embedded, automobile"
243,,,1,2009,GenMAPP,,
244,,,1,2010,"GenMAPP, Cytoscape, WikiPathways & Reactome",,
245,,,3,2011,Genome Informatics,,
246,,,1,2009,Gentoo,,
247,"A flexible, source-based Linux distribution.",Operating Systems,10,2016,Gentoo Foundation,"shell script, c/c++, python, perl, sql","virtualization, security, linux, embeddded, operating systems"
248,Scalable algorithms for geometric statistics,Science and Medicine,1,2020,GeomScale," c++, r,  python","mathematical software, statistics, biology, optimization, finance"
249,,,3,2011,Gephi Consortium,,
250,,,1,2010,Gephi NGO,,
251,Promote Openness with the use and development of Open Standards & Open Source.,Other,1,2018,GFOSS - Open Technologies Alliance,"python 3, php/javascript/html,  css/html, java, c/c++","python, gtk, java jsp, c++ tools, javascript"
252,,,1,2012,GIMP,,
253,"fast, scalable, distributed revision control system",Programming Languages and Development Tools,10,2016,Git,"c, shell script, git","version control, dvcs"
254,,,1,2009,Git Development Community,,
255,How people build software,,2,2016,GitHub,"git, atom, node.js, ruby, c#","git, version control, editor, collaboration"
256,GA4GH develops open standards and tools for genomics to benefit human health,Science and Medicine,2,2016,Global Alliance for Genomics & Health,"python, java, protobuf, sql","genomics, big data, standards, apis, data sharing"
257,We develop open standards and tools for genomics to benefit human health.,Science and Medicine,4,2017,Global Alliance for Genomics and Health," python,  java, sql, c++, mongodb","genomics, standards, data sharing,  bioinformatics, web"
258,"Ease, comfort and control",End User Applications,11,2016,GNOME,"c, python, javascript, gtk+","desktop environment, desktop applications"
259,,,1,2011,GNOME Project,,
260,GNSS-SDR is an open source Global Navigation Satellite Systems software receiver,Social / Communications,8,2016,gnss-sdr,"c/c++, c++11, c++14, gnss","communications, geolocation, navigation, software defined radio"
261,,,1,2011,GnuCash Free Accounting Software,,
262,A set of compilers produced by the GNU project,Programming Languages and Development Tools,1,2019,GNU Compiler Collection," c/c++, gnu autotools","compilers, toolchain, openmp"
263,GCC,Programming Languages and Development Tools,2,2018,GNU Compiler Collection (GCC),"c++, c, openmp",compilers
264,,,3,2009,GNU Image Manipulation Program,,
265,,,1,2010,GNU Image Manipulation Program - GIMP,,
266,Mailman is free software for managing electronic mailing lists.,Social / Communications,3,2016,GNU Mailman,"python, email, django","mailing lists, communication"
267,GNU Octave : Free Your Numbers.,Programming Languages and Development Tools,6,2016,GNU Octave,"hg, c++","mathematics, numerical computation, numerical and data analysis software, matlab, data processing"
268,The GNU Operating System,Operating Systems,8,2016,GNU Project,"posix, c, lisp, python, eiffel","operating systems, free software"
269,The Free and Open Software Radio Ecosystem,Science and Medicine,7,2016,GNU Radio,"c++, python, software radio, dsp, rf","software defined radio, cognitive radio, spectrum analysis, information theory, signal processing"
270,Godot is a multi-platform 2D and 3D game engine with a feature-rich editor,Graphics / Video / Audio / Virtual Reality,3,2018,Godot Engine,"c++, cpp, opengl, github, crossplatform","game engine, gaming, game development, rendering, virtual reality"
271,,,1,2009,Google's Open Source Programs Office,,
272,,,1,2010,Google Caja,,
273,,,1,2015,Google Kubernetes,,
274,,,5,2010,Google Open Source Programs Office,,
275,,,2,2009,Go OpenOffice,,
276,GPAC - Multimedia Open-Source Project,Graphics / Video / Audio / Virtual Reality,2,2016,GPAC,"mp4, dash, mp4box, javascript, c++","streaming, research, industry, playback, multimedia"
277,Simulating electromagnetic wave propagation for Ground Penetrating Radar,Science and Medicine,1,2019,gprMax,"python, cuda, openmp, cython, mpi","engineering, geophysics, science, electromagnetics, ground penetrating radar"
278,,,1,2010,Grameen Foundation,,
279,,,1,2014,Grameen Foundation - MOTECH,,
280,GraphQL is a fast and efficient query language for APIs.,Data and Databases,1,2020,GraphQL Foundation,"graphql,  javascript,  react, node.js","data and databases, api, graphql"
281,,,2,2011,Grassroots DICOM,,
282,"Routing Service for finding the shortest, fastest and most energy efficient way.",End User Applications,2,2016,Green Navigation,"javascript, postgresql, polymer, go, electromobility","web applications, mobile, database, algorithm prototyping/visualization, routing"
283,,,1,2014,Groovy Community,,
284,"A high performance, open source, general RPC framework.",Cloud,2,2016,gRPC,"distributed systems, networking, micro-services, scalability, http/2","cloud, micro services, full stack web and mobile, distributed systems, apis"
285,,,4,2009,GStreamer,,
286,,,1,2009,Hackystat,,
287,Light open-source operating system that specifically targets personal computing.,Operating Systems,9,2017,Haiku,"c++, posix"," desktop integration, operating system, kernel, user interface, frameworks"
288,"Standardized, statically typed, lazy functional programming language",Programming Languages and Development Tools,10,2018,Haskell.org,haskell,"functional-programming, programming languages"
289,In-Memory Computing Platform,Data and Databases,1,2020,Hazelcast,"java,  distributed systems","in memory data grid, data streaming, stream processing"
290,Health information system which is being used by 47 countries across world.,,3,2016,Health Information Systems Programme,"java, android, javascript, reactjs, gradle","mobile, data processing, gis, e-health, global health and development"
291,,,2,2011,Hedgewars Project,,
292,,,3,2011,"HelenOS group at Department of Distributed and Dependable Systems, Charles University in Prague",,
293,,,1,2011,Helsinki Institute for Information Technology,,
294,Package management software for OS X.,,4,2016,Homebrew,"ruby, git, osx","package system, homebrew"
295,,,1,2015,HPCC Systems®,,
296,,,1,2011,Hugin - Panorama photo stitcher,,
297,,,1,2009,Hugin/Panotools,,
298,,,1,2010,Hugin and panotools,,
299,Automate REST APIs. Next generation API clients.,Web,2,2019,Hydra Ecosystem,"python, redis, flask, javascript, sql","semantic web, api, web, hydra, docker"
300,,,3,2011,illumos,,
301,Open Source successor of OpenSolaris,Operating Systems,1,2017,illumos.org,"dtrace, illumos, unix, openzfs, zfs","drivers, virtualization, storage, networking, kernel"
302,Advancing global collaborative brain research,Science and Medicine,4,2017,INCF,"c++, python, java, xml, gpu","neuroscience, big data, brain modeling, science, bio/neuro image processing"
303,The IDI addresses the challenge of designing ICT to work for all potential users,End User Applications,7,2016,Inclusive Design Institute,"javascript, jquery, html5, css, node.js","accessibility, inclusivity, web applications, web"
304,,,1,2011,Inclusive Design Institute (IDI),,
305,Improving Information Infrastructure and Access to Knowledge in Indian languages,End User Applications,1,2016,Indic Project,"android, python, javascript, ruby on rails, c++","natural language processing, language techology, input methods"
306,"Inkscape is a professional vector graphics editor for Windows, OS X, and Linux.",Graphics / Video / Audio / Virtual Reality,11,2016,Inkscape,"c++, python, svg, css, gtk+","graphics, web"
307,SOFA is an efficient simulation engine for research in medical simulation.,Science and Medicine,1,2018,Inria Foundation,"c/c++, qt, webassembly, asm, communication protocol","medical simulation, medical research, physics, real-time, scientific computing"
308,Research in Artificial Intelligence and Perception for Autonomous Mobile Robots,Science and Medicine,4,2017,Institute for Artificial Intelligence,"lisp, prolog, c++, python, ros","artificial intelligence, robotics, knowledge representation, machine learning, robot perception"
309,Putting scientific research into practice.,Graphics / Video / Audio / Virtual Reality,1,2019,Institut für Angewandte Informatik (InfAI) e.V.,"java,  javascript, a-frame, neo4j, htc vive","virtual reality, software quality, visualization, software analytics,  web"
310,"Open Source Media libraries, Applications and User space driver.",Graphics / Video / Audio / Virtual Reality,4,2017,Intel Media and Audio for Linux,"video, decode, encode, vpp, multimedia","accelerated media, video, compress, encoding, camera"
311,,,1,2015,Interactive Spaces,,
312,,,2,2011,Interface Ecology Lab @ Texas A&M University,,
313,"Integrating biological data sources, making it easy to query and analyse data",Science and Medicine,2,2018,InterMine,"postgresql,  java,  javascript, python, clojure","biology, genomics, data science, open science, bioinformatics"
314,,,4,2010,International GeoGebra Institute,,
315,Advancing global collaborative brain research,Science and Medicine,6,2016,International Neuroinformatics Coordinating Facility,"c++, python, gpu, javascript, java","neuroscience, data science, simulation, visualization, big data"
316,Universal Access to All Knowledge,Web,4,2017,Internet Archive,"python, javascript","web archiving, non-profit"
317,We support critical internet infrastructure with quality open source,Operating Systems,2,2018,Internet Systems Consortium,"dhcp, c/c++, mysql, cassandra, rest","networking, stateful, infrastructure, ipv6"
318,,,1,2013,Iowa Flood Center,,
319,,,1,2015,IP-over-P2P Project,,
320,,,1,2012,iPXE,,
321,,,1,2011,Isabelle,,
322,,,2,2013,Italian Mars Society ,,
323,The open-source reference manager,End User Applications,1,2019,JabRef,"java, javafx, latex","academia, reference manager, bibtex, pdf"
324,,,1,2009,Jato,,
325,,,1,2011,Jato VM,,
326,JPF is a highly extensible Java virtual machine built for sofware verification,Programming Languages and Development Tools,1,2016,Java Pathfinder Team,"java, jvm, android, distributed systems","program analysis, testing, verification, model checking, environment generation"
327,Community of Java projects around JBoss Middleware,Programming Languages and Development Tools,9,2016,JBoss Community,"java, android, ide, aerogear, asciidoctor","testing, monitoring, enterprise applications, mobile, eclipse"
328,A software framework for developing applications in robotics and computer vision,Other,5,2017,JdeRobot - Universidad Rey Juan Carlos,"python, c/c++, ros, gazebo","robotics, computer vision, robot simulator, teaching"
329,Jenkins is an open-source automation server,Programming Languages and Development Tools,4,2016,Jenkins Project,"java, groovy, jenkins, css, html","automation, continuous integration, continuous delivery, java, development"
330,Java library that provides graph data-structures and algorithms.,Programming Languages and Development Tools,1,2018,JGraphT,java,"graphs, algorithms, data structures, mathematics, network analysis"
331,,,3,2010,Jikes RVM,,
332,Advanced Real-Time Communication,Social / Communications,3,2017,Jitsi,"webrtc, java, javascript, sip, xmpp","multimedia, real time"
333,,,1,2011,"Jitsi (SIP Communicator), Kamailio and SEMS",,
334,,,1,2014,jMonkeyEngine,,
335,A free and Open Source CMS Trusted By Millions for their Websites,Web,2,2017,Joomla,"php, html, html/css,  javascript, jquery","web, web application,  cms,  object-oriented"
336,"A Free and Open Source CMS, Trusted By Millions for their Websites",,4,2016,Joomla!,"php, css, html, javascript, jquery","cms, object-oriented, mvc, web"
337,,,2,2013,Joomla! (Open Source Matters),,
338,A note taking and to-do application with synchronisation capabilities,End User Applications,1,2020,Joplin,"node.js, electron, react native, terminal-kit, react","notes, synchronisation, sharing, encryption, cross-platform"
339,"jQuery Foundation - home of jQuery, Dojo and many other JavaScript libraries",,2,2016,jQuery Foundation,"javascript, html5, css, jquery","unit testing, software testing, framework development, user interface components, event handling"
340,,,2,2012,JRuby,,
341,JSK Robotics Laboratory / The University of Tokyo,Science and Medicine,2,2016,JSK Robotics Laboratory,"euslisp, openhrp, openrtm, ros",robotics
342,JSK is focusing on the fundamental functions & systems for intelligent robots .,Science and Medicine,2,2018,JSK Robotics Laboratory / The University of Tokyo,ros,robotics
343,K-9 Mail – Advanced Email for Android,End User Applications,2,2017,K-9 Mail,"android, java","email, communication"
344,Generic templated configuration management for kubernetes and more,Programming Languages and Development Tools,2,2019,Kapitan,"kubernetes, terraform, python, jinja2, jsonnet","cloud, kubernetes"
345,KDE is an international technology team that creates user-friendly software,Other,9,2016,KDE,"qt, cmake, c++, php","desktop applications, mobile, education, graphics, wiki"
346,Experience Freedom!,End User Applications,3,2018,KDE Community,"qt, c/c++, qml","applications, desktop environment"
347,,,3,2010,Kernel.org - the Linux Kernel Organization,,
348,Internet content for people without internet access,End User Applications,3,2018,Kiwix,"android, java, c++, python, qt","offline, android"
349,Open for Innovation,Data and Databases,1,2019,KNIME,"javascript, java, tensorflow","data analytics, data science, machine learning, deep learning, image processing"
350,The ultimate entertainment center,End User Applications,2,2019,Kodi Foundation,"c++, ffmpeg, sqlite, mysql, python","media, video, audio, games"
351,KolibriOS Project team,Operating Systems,1,2016,KolibriOS,"fasm, flat assembler, x86 assembly, i386, i586","desktop, operating systems, drivers, hardware, lowlevel"
352,,,1,2014,KolibriOS Project Team,,
353,,,1,2012,Komodo OpenLab,,
354,,,1,2011,Komodo OpenLab Inc.,,
355,The machine learning toolkit for Kubernetes.,Cloud,1,2020,Kubeflow,"python, jupyter notebook, tensorflow, kustomize, kubernetes","machine learning, infrastructure, cloud, kubernetes"
356,LabLua - Lua programming language research lab at PUC-Rio,Programming Languages and Development Tools,7,2016,LabLua,"lua, luarocks, elasticsearch, netbsd, céu","programming languages, operating systems, distributed systems, scripting"
357,,,1,2014,Laboratory for Cosmological Data Mining,,
358,,,1,2011,LanguageTool,,
359,Style and grammar checker,End User Applications,1,2018,languagetool.org,"java, javascript, machine learning, ai, tensorflow","artificial intelligence, language, edtech, education, nlp"
360,We make encryption easy to use.,End User Applications,2,2018,LEAP Encryption Access Project,"python, twisted, javascript, openvpn, gnupg","e2e, mail, vpn, encryption"
361,,,1,2011,Learning Unlimited,,
362,,,1,2012,"Learning Unlimited, Inc.",,
363,,,1,2012,Libav,,
364,Healthcare for Humanity,Science and Medicine,4,2017,LibreHealth,"java, php, javascript, mysql",web
365,LibreOffice is a powerful cross-platform office suite.,End User Applications,10,2016,LibreOffice,"c++, python, java, android, opengl","office suite, cloud, big project"
366,Open-source software and hardware technologies for space,Science and Medicine,2,2019,Libre Space Foundation," python, django, arduino, raspberry pi,  c/c++","web applications, hardware, cubesats, space applications,  software defined radio"
367,Stable API for easier virtualization.,Cloud,5,2016,Libvirt,"c, qemu, xen, containers","cloud, virtualization"
368,,,3,2009,LimeSurvey,,
369,,,1,2014,Linaro,,
370,Ultralight service mesh for Kubernetes and beyond,Cloud,2,2019,Linkerd,"golang, rust, kubernetes,  react, prometheus","service mesh, cloud native, networking, kubernetes, dev-ops"
371,,,2,2013,Linux Trace Toolkit next generation project (LTTng),,
372,Liquid Galaxy Project: wraparound open-source immersion!,Graphics / Video / Audio / Virtual Reality,9,2016,Liquid Galaxy Project,"javascript, ros, gis, cesium","virtual reality, geospatial, graphics"
373,llvm,Programming Languages and Development Tools,8,2017,LLVM Compiler Infrastructure,"llvm, clang","compiler, compilers"
374,,,3,2013,lmonade: scientific software distribution,,
375,Creating a fully open-source SoC design,,4,2016,lowRISC,"verilog, fpga, chisel, c++, linux","embedded hardware, system-on-chip, security, education, debug"
376,The package manager for the Lua programming language,Programming Languages and Development Tools,3,2017,LuaRocks,"lua,  lua, luarocks","programming tools, programming language, package management"
377,,,1,2010,LXDE Project,,
378,,,2,2013,LyX – The Document Processor,,
379,Package manager for macOS,End User Applications,3,2019,MacPorts,"tcl, c, python, scripting, web","package management, macos, operating systems, build tools, libraries"
380,,,2,2009,Maemo Community,,
381,,,2,2010,Mapnik,,
382,One of the most popular databases on the web with many notable users,Data and Databases,5,2016,MariaDB,"mysql, mariadb, c, perl","databases, database"
383,One of the most popular databases on the web with many notable users,Data and Databases,3,2018,MariaDB Foundation,"mariadb, mysql, c, c++, java","database, sql"
384,,,1,2011,Marine Biological Laboratory - Center for Library and Informatics,,
385,,,1,2010,Marine Biological Laboratory Biodiversity Informatics Group-Encyclopedia of Life Project,,
386,,,1,2013,Maryland Institute for Technology in the Humanities,,
387,"An open network for secure, decentralized communication",Social / Communications,1,2020,Matrix,"python, javascript, rust, go,  react","encryption, realtime communication, decentralised, team chat, chat"
