,About,Category,Count,Last Appeared,Organizations,Technology,Topics
388,"An ambitious opensource project creating a new, decentralised comms ecosystem.",Social / Communications,4,2016,Matrix.org,"react, android, ios, golang, python","real time, communications, collaboration, interoperability, iot"
389,High fidelity multibody dynamics engine with extended capabilities,Science and Medicine,2,2017,MBDyn,"c++, python","engineering, science, numerical methods, aerospace, mechanics"
390,,,1,2015,"MBDyn, Department of Aerospace Engineering at the Polytechnic University of Milan",,
391,MBDyn is a multidisciplinary Multibody Dynamics scientific simulation software.,Science and Medicine,1,2016,"MBDyn, Department of Aerospace Science and Technology at Politecnico di Milano",c++,"physics, engineering, simulation, robotics, real time"
392,Scientific mechanical simulation tool for engineering research and development,Science and Medicine,1,2019,MBDyn - Multibody Dynamics," python, c++, scripting","mechanical engineering, aeronautics, multibody dynamics, aerodynamics, linear algebra"
393,Center bringing together scientists doing space-related research at McGill,Science and Medicine,1,2016,McGill Space Institute,"python, sql, databases, big data","space, astronomy"
394,A Python toolkit for analysing molecular dynamics simulations.,Science and Medicine,1,2020,MDAnalysis,"python, cython, numpy, c/c++","biophysics, computational chemistry, molecular simulation, cheminformatics, molecular dynamics"
395,,,1,2012,Measurement Lab,,
396,,,1,2013,Measurement Lab (M-Lab),,
397,,,1,2015,MEDES-IMPS,,
398,,,6,2009,Melange,,
399,,,1,2013,Mercurial,,
400,,,1,2009,Mercurial (a member of the Software Freedom Conservancy),,
401,,,1,2010,Mercurial Distributed Version Control System,,
402,We curate data and make it freely available!,Data and Databases,2,2016,MetaBrainz Foundation,"python, perl, postgresql, javascript","music, metadata, machine learning, big data, books"
403,MetaBrainz curates and makes available metadata about music and books.,Data and Databases,1,2019,MetaBrainz Foundation Inc,"python, perl, javascript, postgres, react","music, books, open data, metadata, community"
404,MetaBrainz operates MusicBrainz and a number of related open data projects.,Data and Databases,9,2017,MetaBrainz Foundation Inc.,"postgres, perl, python, javascript, bigquery","music, data, big data, open data, community"
405,,,1,2012,Metalink,,
406,Open Source framework for exploit development and penetration testing,Security,3,2017,Metasploit,"ruby, c, asm","security, exploitation"
407,MGGG researches applications in math and computer science for US redistricting,End User Applications,1,2020,MGGG Redistricting Lab,"python, javascript, gis, julia, mapping","web-interface, statistics, graph algorithms, mapping, civic tech"
408,"Confederation of microkernel projects (Genode, HelenOS, GNU Hurd, MINIX, Redox)",Operating Systems,1,2017,Microkernel devroom,"c, c++, rust, arm, x86","microkernel, components, ipc, desktop, virtualization"
409,,,1,2009,Mifos,,
410,,,1,2013,Mifos (The Community for Open Source Microfinance),,
411,End Poverty One Line of Code at a Time,End User Applications,3,2016,Mifos Initiative,"java, javascript, angularjs, android, mysql","fintech, financial inclusion, cloud, big data, mobile"
412,,,2,2009,MINIX 3,,
413,,,1,2010,MINIX 3 Group at the VU,,
414,,,1,2011,"MINIX 3 Research group at the Vrije Universiteit in Amsterdam, The Netherlands",,
415,,,1,2015,MinnowBoard Project,,
416,Empowering anyone to make their world a better place,Programming Languages and Development Tools,3,2017,MIT App Inventor,"java, javascipt, app, google app engine, gwt","mobile apps, api, blockchain, education, iot"
417,,,1,2012,MIT Center for Mobile Learning @ The Media Lab,,
418,Build Your own Android Apps!,End User Applications,2,2016,MIT Media Lab,"java, html/javascript, android","educational technology, education"
419,DJ Mixing App With Powerful Features For All DJs,End User Applications,2,2020,Mixxx,"c++, qt,  javascript, deep learning","music, dj, streaming, music information retrieval"
420,,,1,2010,Mixxx Digital DJ,,
421,"DJ Your Way, For Free. Join our friendly community of hackers, DJs, and artists!",Graphics / Video / Audio / Virtual Reality,6,2016,Mixxx DJ Software,"c++11, c++, qt, audio, opengl","real time, audio, dj, music"
422,a scalable C++ machine learning library,Data and Databases,4,2017,mlpack,c++,machine learning
423,a scalable C++ machine learning library,Science and Medicine,1,2016,mlpack: a scalable C++ machine learning library,c++,"machine learning, data mining, fast algorithms"
424,,,2,2013,mlpack: scalable C++ machine learning library,,
425,,,1,2013,MLton.org,,
426,Mobile Robot Programming Toolkit: empowering C++ development in robotics,Science and Medicine,3,2016,Mobile Robot Programming Toolkit (MRPT),"c++, ros, opencv, cmake, qt","robotics, selfdriving, slam, mobile robots, vision"
427,ModSecurity cross platform web application firewall,Security,1,2016,ModSecurity,"waf, web application firewall",web application security
428,,,1,2011,MoinMoin,,
429,,,4,2009,MoinMoin Wiki,,
430,Moira is a realtime alerting system based on Graphite data,Programming Languages and Development Tools,2,2019,Moira,"golang,  javascript, typescript, grafana, graphite"," devops, alerting, monitoring, devtools, sre"
431,,,1,2012,Monkey HTTP Daemon,,
432,,,2,2013,Monkey Project,,
433,Cross-platform C#/F#/.NET runtime and tools,Programming Languages and Development Tools,7,2017,Mono Project,"c#, .net, f#, c","compiler, ide, mobile development, web development, programming tools"
434,The world's open source learning platform,Social / Communications,10,2016,Moodle,"php, jquery, mysql, postgresql, javascript","education, web applications, e-learning, school systems, learning management"
435,Moving robots into the future,Other,1,2020,MoveIt,"c++, ros",robotics
436,Terasology: like an open source Minecraft - imagine the possibilities!,End User Applications,3,2016,MovingBlocks,"java, lwjgl, opengl, blender, gradle","game, voxel, minecraft, sandbox, modding"
437,We're building a better Internet,,10,2016,Mozilla,"c++, python, javascript, html, rust","web, mozilla, firefox, internet"
438,,,1,2009,Mozilla Project,,
439,"MuseScore: Create, play and print beautiful sheet music",Graphics / Video / Audio / Virtual Reality,7,2016,MuseScore,"qt, c/c++, qml","music, notation, midi, musicxml, sheet music"
440,Mypy is an optional static type checker for Python.,Programming Languages and Development Tools,1,2020,mypy,python,"static code analysisâ€Ž, compiler"
441,,,1,2012,mySociety,,
442,,,1,2009,MySQL,,
443,MZmine is an open-source software for mass-spectrometry data processing.,Science and Medicine,1,2020,MZmine,"java, javafx","mass spectrometry, molecular analysis, visualization, data processing, molecular networking"
444,A Content-Centric Future Internet architecture,Web,1,2019,Named Data Networking Project,"java, android,  javascript, c++14, c#","networking, informationc centric networking, ipfs"
445,,,1,2009,National Center for Supercomputing Applications,,
446,,,1,2012,National Evolutionary Synthesis Center,,
447,,,2,2011,National Evolutionary Synthesis Center (NESCent),,
448,,,1,2013,National Library of the Czech Republic,,
449,,,1,2011,"National Resource for Network Biology (GenMAPP, Cytoscape and WikiPathways)",,
450,Developing open source software to enable network-based biomedical discovery,Science and Medicine,8,2016,National Resource for Network Biology (NRNB),"c++, java, javascript, php, python","dataviz, web, bioinformatics, systems biology, biology"
451,,,1,2009,Native Client,,
452,,,3,2009,Natural User Interface Group,,
453,,,1,2010,Natural User Interface Group (NUI Group),,
454,Vim-fork focused on extensibility and usability,Programming Languages and Development Tools,3,2018,Neovim,"lua, c, vim, javascript,  python","text editor, vim, cross platform, tools"
455,,,2,2009,NESCent - National Evolutionary Synthesis Center,,
456,Netfilter project,Operating Systems,6,2016,Netfilter project,"firewall, linux kernel, networking","firewall, linux kernel, networking"
457,,,2,2009,NetSurf,,
458,Netty is an asynchronous event-driven network framework,Web,1,2020,Netty,"java, jni, c","nonblocking, network, async"
459,,,1,2012,Network Time,,
460,,,2,2013,Network Time Foundation,,
461,,,1,2012,New Visions for Public Schools,,
462,,,1,2012,Ninux.org,,
463,Swiss Army knife of network discovery and security auditing,Security,9,2016,Nmap Security Scanner,"c/c++, lua, python, c, c++","security, networking, ipv6, linux, network mapping"
464,,,1,2011,NTP,,
465,,,1,2009,NTP Project,,
466,NumFOCUS promotes open source scientific software.,Science and Medicine,6,2016,NumFOCUS,"python, javascript, julia, r","scientific computing, graphics, data science, numerical computation"
467,Empowering lives through non-visual access to technology,Other,2,2019,NV Access,"python, c++, ui automation, iaccessible2, win32 api","accessibility, blindness, screen reader, braille, text to speech"
468,,,2,2009,OAR,,
469,,,3,2012,OGDF - Open Graph Drawing Framework,,
470,,,1,2009,OGRE,,
471,,,2,2012,OGRE (Object-Oriented Graphics Rendering Engine) ,,
472,,,1,2011,OGRE - Open Source 3D Graphics Engine,,
473,omegaUp is aimed to increase the number of talented Software Engineers in LatAm.,Web,1,2018,omegaUp.com,"php, mysql,  python","cs education, education, web community"
474,,,2,2009,OMII-UK,,
475,,,1,2015,OncoBlocks,,
476,,,1,2009,Open64,,
477,,,2,2009,OpenAFS,,
478,Confederation of open source projects in Astronomy,Science and Medicine,5,2016,OpenAstronomy,"python, julia, c, numpy","science, astronomy, solar physics, atomic physics, visualization"
479,Supporting OSS and Open Science in the biological research community.,Science and Medicine,8,2016,Open Bioinformatics Foundation,"perl, python, ruby, java, haskell",bioinformatics
480,Promoting practice & philosophy of OSS & Open Science in biological research.,Science and Medicine,1,2020,Open Bioinformatics Foundation (OBF),"python,  javascript, c/c++","bioinformatics, computational biology"
481,,,1,2012,Opencast Matterhorn ,,
482,Planet Scale Tracing and Monitoring,Cloud,1,2018,OpenCensus,"python, java, ruby, node, go","tracing, monitoring, c++, php"
483,,,1,2009,OpenChange (a project of the Free Software Conservancy),,
484,Open source chemistry software libraries and tools,Science and Medicine,5,2016,Open Chemistry,"c++, opengl, python, javascript, webgl","chemistry, materials science, graphics, visualization"
485,,,1,2012,OpenCog Foundation,,
486,,,1,2009,OpenCog sponsored by the Singularity Institute for Artificial Intelligence,,
487,Open Source Computer Vision and Machine Learning Library,Graphics / Video / Audio / Virtual Reality,4,2016,OpenCV,"c++, python, machine learning, computer vision","computer vision, machine learning, robotics, virtual reality, real time"
488,,,1,2010,"OPeNDAP, Inc.",,
489,Open Data Kit is used to collect data for social good in difficult environments.,End User Applications,3,2017,Open Data Kit,"android, java, python, javascript, ruby"," mobile, cloud, global development, global health, social good"
490,Open Detection is a open source project for object detection and recognition.,,2,2016,Open Detection,"c/c++, cmake, opencv, pcl, caffe","computer vision, machine learning"
491,,,1,2014,Open Education Resource Foundation,,
492,OpenEMR is a leader in healthcare open-source software,Science and Medicine,1,2020,OpenEMR,"php, mysql,  javascript, docker,  html","medical records, health, cloud, medicine, medical practice management solution"
493,Open-source electrophysiology,Science and Medicine,1,2016,Open Ephys,"c++, juce","neuroscience, electrophysiology, visualization, ui, signal processing"
494,,,1,2012,OpenFlowHub,,
495,"A collaborative, free and open database of food and cosmetic products.",Science and Medicine,1,2018,Open Food Facts,"perl, mongodb, ios, android, machine learning","computer vision, crowdsourcing, open data, food, health"
496,Open Genome Informatics represents the efforts of many bioinformatics projects.,Science and Medicine,3,2016,Open Genome Informatics,"python, java, html/javascript, nodejs, gwt","bioinformatics, data visualisation, genome, computational biology, databases"
497,Multi-Platform Open Source driver for AR/VR/XR devices with stable ABI.,Graphics / Video / Audio / Virtual Reality,1,2020,OpenHMD,"c99, opengl, vulkan, opencv, libusb","virtual reality, xr, drivers, reverse engineering, computer vision"
498,,,3,2009,OpenICC,,
499,,,1,2011,OpenICC Color Management,,
500,,,4,2009,OpenImageIO,,
501,,,1,2010,OpenInkpot project,,
502,,,2,2011,OpenIntents,,
503,OpenKeychain: Easy PGP for Android,Security,3,2016,OpenKeychain (OpenPGP for Android),"android, openpgp","security, e-mail, encryption"
504,,,3,2012,Open Lighting Project,,
505,Answer questions using data you cannot see.,Other,1,2020,OpenMined,"deep learning, federated learning, homomorphic encryption, secure multi-party computation, differential privacy","privacy, artificial intelligence"
506,,,1,2014,Open Motion Planning Library,,
507,Write code. Save lives.,Science and Medicine,12,2016,OpenMRS,"java, groovy, html5, xml, hibernate","medical records, health, clinics, ehealth, hospitals"
508,,,1,2010,OpenNebula,,
509,,,1,2013,Open Networking Lab,,
510,,,3,2011,OpenNMS,,
511,"a free, open source power tool for working with messy data and improving it",Data and Databases,1,2020,OpenRefine," java,  javascript","real-time, data visualization,  data integration, web application"
512,Open Roberta® Lab is an online IDE introducing kids to program robots with NEPO®,Programming Languages and Development Tools,2,2019,Open Roberta," java,  javascript","education,  web, visual programming, robotics"
513,Open Roberta® Lab is an online IDE introducing kids to program robots with NEPO®,Web,1,2018,Open Roberta Lab,"java, javascript","education, programming, robotics"
514,"A multi-purpose Open Source SIP proxy/server for carriers, telecoms or ITSPs",Social / Communications,1,2018,OpenSIPS,"c,  python, mysql, scripting","voip, telephony, real-time-communications, sip"
515,,,1,2010,Open Source Computer Vision Library,,
516,,,5,2011,Open Source Computer Vision Library (OpenCV),,
517,"Open source software for use in robotics research, education, and industry.",Programming Languages and Development Tools,7,2016,Open Source Robotics Foundation,"ros, gazebo","robotics, simulation, middleware"
518,,,1,2009,OpenSSH,,
519,Opening State Legislatures,Other,2,2017,Open States,"python, django, javascript, postgresql","government, web, journalism, civic"
520,OpenStreetMap - Creating and distributing free geographic data for the world.,Data and Databases,10,2016,OpenStreetMap,"postgis, java, ruby, javascript, opengl","gis, maps, crowdsourcing, geoinformatics"
521,"openSUSE Linux - The makers' choice for sysadmins, developers and desktop users",Operating Systems,6,2016,openSUSE,"ruby on rails, angularjs, docker, linux, ruby","linux, virtualization, web development, configuration management"
522,openSUSE is a worldwide Free and Open Source Software community and project.,Operating Systems,3,2020,openSUSE Project,"linux,  python, perl, rpm,  javascript","tools, operating systems, software quality, build tools, containers"
523,Promote Openness through use and development of Open Standards and Open Source,Programming Languages and Development Tools,1,2019,Open Technologies Aliance - GFOSS,"python,  javascript, gtk, qt, arduino","robotics, programming languages, open education, c- c+, java"
524,Promote Openness through use and development of Open Standards and Technologies,Other,1,2017,Open Technologies Alliance - GFOSS," php,  java,  mysql,  virtuoso, python","data, cloud, hardware"
525,,,3,2012,Openwall,,
526,,,1,2011,Openwall Project,,
527,Open Source solution to build and manage wifi networks,Web,4,2017,OpenWISP,"python, django, javascript, openwrt, raspberry pi","networking, wireless, configuration management, telecommunications, web"
528,Developing Open Event Solutions for Everyone,Social / Communications,1,2018,OpnTec,"python, javascript, emberjs, cloud, android","open event, event solutions, web"
529,Oppia is used for collaboratively building interactive and intelligent tutors.,,5,2016,Oppia Foundation,"javascript, app engine, python, css, angularjs","education, web, interactive, tools, educational technology"
530,,,1,2010,Opticks,,
531,"A cross-platform, visual-programming tool for data mining and visualization.",Science and Medicine,3,2016,Orange – Data Mining Fruitful & Fun,"python, cython, qt, machine learning","machine learning, visualization, data mining, bioinformatics, gui toolkit"
532,Humans & machines listening together to save the whales.,Science and Medicine,1,2020,Orcasound,"elixir,  react, javascript,  python, raspberry pi","real-time, audio, citizen science, machine learning, web application"
533,,,2,2009,Oregon State University Open Source Lab,,
534,,,5,2011,Oregon State University Open Source Lab (OSUOSL),,
535,Open Source Geospatial Foundation,End User Applications,4,2017,OSGeo,"c++,  python,  c,  sql, java","gis,  cartography,  maps,  science,  geospatial"
536,,,7,2009,OSGeo - Open Source Geospatial Foundation ,,
537,The Open Source Geospatial Foundation,,1,2016,OSGeo - The Open Source Geospatial Foundation,"python, sql, c, ogc standards, c++","gis, science, maps, cartography, geospatial"
538,OSU Open Source Lab,,1,2016,OSU Open Source Lab,"python, rest, javascript, ruby","virtualization, infrastructure"
539,,,1,2014,OSv,,
540,Open virtual datacenter management for all,End User Applications,2,2017,oVirt,"java,  python, kvm","virtualization, enterprise application"
541,The open source community for infrastructure software.,Other,1,2018,OW2,"java, perl, middleware, bpm, wiki","enterprise information systems, cloud, security, middleware"
542,,,1,2013,OWASP,,
543,"OWASP, The Open Web Application Security Project.",Security,6,2016,OWASP Foundation,"python, php, javascript, java, html","appsec, security, application security, sdlc, secure development"
544,A safe home for all your data,End User Applications,2,2016,ownCloud,"javascript, php, css, html, sql","web, cloud, synchronized, data sharing"
545,Shaping the future Internet TV,,4,2016,P2PSP.org,"python, c++, webrtc, android, ios","live streaming, networking, security, p2p, multimedia"
546,,,1,2012,PacketFence,,
547,,,1,2013,PaGMO / PyGMO,,
548,,,1,2015,PaGMO / PyKEP,,
549,,,2,2009,Pardus,,
550,,,3,2011,Parrot Foundation,,
551,Develop accessible tools for reproducible ecosystem modeling and forecasting,Science and Medicine,4,2017,PEcAn Project,"r,  php, postgresql, javascript , c","ecosystem models, ecological forecasting, scientific visualization, data science, climate science"
552,,,1,2015,Pencil Code Foundation,,
553,Digital Assets Managed Neatly,,1,2016,Peragro,"python, blender, javascript, celery, django","analyzing, transcoding, pipeline automation, games, web"
554,Unbiased open source database experts.,Data and Databases,2,2019,Percona,"mysql, postgresql, prometheus, javascript, selenium","database optimization, metrics, testing, monitoring, databases"
555,Performance Co-Pilot - system-level performance analysis toolkit,Operating Systems,5,2016,Performance Co-Pilot,"golang, ruby, java, linux kernel, javascript","monitoring, data analysis, visualization, high performance computing, realtime messaging"
556,Pharo: The Immersive Programming Experience,Programming Languages and Development Tools,2,2017,Pharo Consortium,"smalltalk, roassal, polymath, pharo","object oriented programming, dynamic environment, data science, user interface, ide"
557,,,1,2009,PHP,,
558,phpBB is the most widely used free and open source forum software,Social / Communications,5,2017,phpBB Forum Software,"php , mysql, javascript, symfony, css","social, communication, collaboration, forum, community"
559,A web interface for MySQL written in PHP,Data and Databases,9,2017,phpMyAdmin,"php, mysql, jquery, javascript, cakephp","database, mysql, developer, administrator, web application"
560,The Physical Web Project develops use cases around Google's the Physical Web IoT,,2,2016,Physical Web Project,"internet of things, beacons, python, arduino","internet of things, mobile, web apps"
561,,,3,2012,"Pidgin, Finch, and libpurple",,
562,,,2,2009,"Pidgin, Finch and libpurple",,
563,Allowing everyone on the planet to express themselves through filmmaking,Graphics / Video / Audio / Virtual Reality,2,2019,Pitivi,"python 3, gtk, gstreamer, c","filmmaking, video editing, video processing"
564,,,1,2013,PiTiVi video editor,,
565,,,1,2009,PKIF project,,
566,,,5,2009,Plan 9 from Bell Labs,,
567,"PLASMA explores ways to make programming languages faster, safer, and easier.",Programming Languages and Development Tools,1,2016,PLASMA-UMass,"javascript, c/c++, scala, go","programming languages, programming tools, software engineering, operating systems, runtime systems"
568,,,2,2013,PLASMA @ UMass,,
569,The premier python-based open source CMS,Web,1,2018,Plone,"python,  javascript, html, css, reactjs","communications, collaboration, content management, web"
570,The premier python-based content management system,,7,2016,Plone Foundation,"python, zope, javascript, rest, nosql","content management, enterprise applications"
571,,,1,2010,PLSE at UW,,
572,An extensible cross-language static code analyzer.,Programming Languages and Development Tools,2,2017,PMD,"java, javacc, xml, antlr, xpath","code quality, source code analyzer, code analysis, linter"
573,Miniaturizing the Open Science Lab with Open Hardware and Open Source Software,Science and Medicine,1,2018,Pocket Science Lab,"android, java, firmware, c, cad","science, education, firmware, school apps"
574,An open project for 2D/3D image and point cloud processing.,Graphics / Video / Audio / Virtual Reality,1,2020,Point Cloud Library,"cpp, cmake, devops","3d computer vision,  robotics, perception"
575,,,3,2011,Point Cloud Library (PCL),,
576,Promoting Polyhedral Compilation,Programming Languages and Development Tools,2,2017,Polly Labs,"llvm, integer set library, ppcg, pencil, polly","polyhedral compilation, parallelization, program verification, optimization, fpga"
577,,,1,2015,Portable Native Client,,
578,Portland State University,,9,2016,Portland State University,"open hardware, language-agnostic","new projects, academic projects, individual projects"
579,"PostgreSQL is a powerful, open source object-relational database system.",Data and Databases,5,2017,PostgreSQL,"postgresql, c, perl, sql","database, rdbms"
580,,,1,2011,PostgreSQL Global Development Group,,
581,,,4,2012,PostgreSQL Project,,
582,The Collaboration Platform for API Development,Programming Languages and Development Tools,1,2020,Postman,"node.js,  javascript","api management,  developer tools, api, programmer productivity"
583,,,1,2010,Princeton Center for Information Technology Policy,,
584,PRISM is a tool for formally verifying the correctness of probabilistic systems.,Science and Medicine,3,2016,PRISM Model Checker,"java, c++","science, verification, probabilistic models"
585,,,1,2015,Privly Foundation,,
586,Automate and improve GitHub workflows,Programming Languages and Development Tools,1,2018,Probot,"javascript, node, github","bot, automation, development tools"
587,,,3,2011,Processing,,
588,Our goal is to empower people of all backgrounds to learn how to program.,Programming Languages and Development Tools,1,2020,Processing Foundation," python,  android,  opengl,  java,  javascript","creative coding, graphics, web,  education, design"
589,Discover New Worlds,Science and Medicine,1,2019,Project PANOPTES,"python 3, arduino, cloud","astronomy, robotics, exoplanet, image processing"
590,,,1,2014,Project Tox,,
591,,,1,2009,"Ptolemy Project, University of California, Berkeley",,
592,Open hardware and software to help communities measure and analyze pollution,Science and Medicine,4,2016,Public Lab,"javascript, ruby on rails, leaflet, webrtc","environment, pollution, science, hardware, community"
593,,,2,2013,Public Laboratory for Open Technology and Science,,
594,,,2,2012,PulseAudio,,
595,,,1,2010,Puppet (Reductive Labs),,
596,,,1,2012,Puppet Labs,,
597,Visual Programming Language for Realtime Multimedia,Programming Languages and Development Tools,3,2018,Purr Data,"javascript, html5/css3, node.js, c/c++","real-time, audio, dsp, video, data vizualisation"
598,Build better Web APIs. Enable smart clients.,Web,1,2018,Python HYDRA,"python, rdf, flask, hydra, json/json-ld","apis, database, functional-programming, semantic web, knowledge graph"
599,Python is programming language popular among scientists and more.,Science and Medicine,12,2016,Python Software Foundation,"python, mercurial","image analysis, biology, physics, mathematics, hardware"
600,Open source machine emulator and virtualizer,,7,2016,QEMU,"c, assembly, kvm","virtualization, compilers, operating systems, emulation"
601,,,2,2011,QEMU.org,,
602,,,1,2010,QEMU development team,,
603,,,1,2013,Quagga @ OpenSourceRouting / ISC,,
604,A reasonably secure operating system,Operating Systems,2,2017,Qubes OS,"c, python, shell, xen, linux","security, privacy, virtualization, operating system"
605,Helping millions of learners become better writers and critical thinkers,Web,1,2018,Quill.org,"ruby, rails, react, javascript, postgresql","education, edtech, machine learning, nlp, web"
606,radare is a reverse engineering framework and toolset,Security,3,2016,radare,"c, rust","reverse engineering, disassembly, decompilation, security, assembly"
607,Radare2 reverse engineering framework and toolset,Security,1,2017,radare2,"c, rust, python, nodejs",reverse engineering
608,,,3,2012,Raxa,,
609,"ReactOS is a free, open source, Windows compatible operating system.",Operating Systems,6,2016,ReactOS,"c/c++, c","operating systems, drivers, desktop, kernel, windows"
