,Organizations,About,Technology,Category,Topics
132,P2PSP.org,Shaping the future Internet TV,"python,  javascript, webrtc, sockets, c/c++",Graphics / Video / Audio / Virtual Reality,"live streaming, real time, distributed networks, p2p, video"
133,PEcAn Project,Develop accessible tools for reproducible ecosystem modeling and forecasting," javascript, postgresql,  php, c, r",Science and Medicine," scientific visualization,  data science,  climate science, ecosystem models, ecological forecasting"
134,Performance Co-Pilot,Performance Co-Pilot - system-level performance analysis toolkit,"python, redis, c, linux, javascript",Operating Systems,"high performance computing, visualization, web development, kernel, performance"
135,phpBB Forum Software,phpBB is the most widely used free and open-source forum solution.,"mysql,  javascript, html5/css3, php, symfony",Social / Communications,"social, communication, collaboration, forum, community"
136,phpMyAdmin,A web interface for MySQL written in PHP,"php, mysql, cakephp, jquery, javascript",Data and Databases,"mysql, developer, administrator, web applications, database"
137,Plone,The premier python-based open source CMS,"python,  javascript, html, css, reactjs",Web,"communications, collaboration, content management, web"
138,PMD,An extensible cross-language static code analyzer.,"java, xml, javacc, antlr, xpath",Programming Languages and Development Tools,"code analysis, code quality, source code analyzer, linter"
139,Pocket Science Lab,Miniaturizing the Open Science Lab with Open Hardware and Open Source Software,"android, java, firmware, c, cad",Science and Medicine,"science, education, firmware, school apps"
140,Polly Labs,Promoting Polyhedral Compilation,"c/c++, llvm, polly, isl, ppcg",Programming Languages and Development Tools,"compilers, polyhedral model"
141,PostgreSQL,"PostgreSQL is a powerful, open source object-relational database system.","postgresql, sql, rdbms, ordbms, c",Data and Databases,"sql, database, big data"
142,Probot,Automate and improve GitHub workflows,"javascript, node, github",Programming Languages and Development Tools,"bot, automation, development tools"
143,Public Lab,Open hardware and software to help communities measure and analyze pollution,"ruby on rails, javascript, node.js",Science and Medicine,"science, environment, collaboration, community, hardware"
144,Purr Data,Visual Programming Language for Realtime Multimedia,"javascript, html5/css3, node.js, c/c++",Programming Languages and Development Tools,"real-time, audio, dsp, video, data vizualisation"
145,Python HYDRA,Build better Web APIs. Enable smart clients.,"python, rdf, flask, hydra, json/json-ld",Web,"apis, database, functional-programming, semantic web, knowledge graph"
146,Python Software Foundation,Python is a programming language used by software developers and scientists.,python,Science and Medicine,"programming languages, science"
147,QEMU,QEMU is an open source machine emulator and virtualizer,"c, kvm",Cloud,"emulation, hypervisor, kernel, lowlevel, cloud"
148,Quill.org,Helping millions of learners become better writers and critical thinkers,"ruby, rails, react, javascript, postgresql",Web,"education, edtech, machine learning, nlp, web"
149,R project for statistical computing,R is a free software environment for statistical computing and graphics,"r-project, c, c++, javascript, fortran",Programming Languages and Development Tools,"data science, visualization, statistics, graphics, machine learning"
150,radare,Radare2 reverse engineering framework and toolset,"c, cpp, rust, qt",Security,reverse engineering
151,ReactOS,"ReactOS is a free, open source, Windows compatible operating system.","c, c++",Operating Systems,"operating systems, drivers, desktop, kernel, windows"
152,Read the Docs,Read the Docs hosts documentation for the open source community.,"python, sphinx, django, javascript, elasticsearch",Programming Languages and Development Tools,"docs, web, communications"
153,Red Hen Lab,Research on Multimodal Communication,"python, scikit-learn, tensorflow, singularity, syntaxnet",Science and Medicine,"multimedia, audio processing, video processing, artificial intelligence, machine learning"
154,RoboComp,RoboComp is an open-source framework to develop and manage robot components.,"c/c++, python, cmake, openscenegraph, ice - zeroc",Other,"robotics, computer vision, simulation"
155,Rocket.Chat,The ultimate free open source solution for team communications," javascript, ios, android, node, meteor.js",Social / Communications,"chat, collaboration, machine learning, chatops, bot"
156,Rspamd,An advanced spam filtering system,"c, machine learning, javascript, lua",Security,"email, spam filtering, high performance computing"
157,RTEMS Project,RTEMS is a real-time operating system kernel used around the world and in space.,"c, python, posix, bsd unix",Operating Systems," kernel,  embedded systems,  multicore, iot, real time"
158,Ruby,"The Ruby programming language, libraries, and tools",ruby,Programming Languages and Development Tools,programming languages
159,Ruby on Rails,Ruby on Rails is web framework that optimizes for programmer happinness.,"ruby, ruby on rails, html",Web,"web, web development, web applications"
160,Ruby Science Foundation,Scientific Computing tools for Ruby,"ruby, c, c++, cuda",Science and Medicine,"visualization, compilers, parallel algorithms, data science, artificial intelligence"
161,Sage Mathematical Software System,"Creating a viable free alternative to Magma, Maple, Mathematica and Matlab.","python 3, python, cython, c/c++",Science and Medicine,"mathematics, toolbox"
162,Scala,The programming language where object-oriented meets functional.,"scala, jvm, llvm",Programming Languages and Development Tools,"compilers, programming-tools, functional-programming, programming-language"
163,Scilab,Cross-platform numerical computational package and programming language.,"c, c++, java, scilab",End User Applications,"science, mathematics, numerical computation, graphics"
164,ScummVM,ScummVM is a GSoC umbrella for game preservation projects,"c++, opengl, sdl, assembly",End User Applications,"games, game engines, software preservation"
165,Seastar,Framework for writing high-performance server applications on modern hardware,"cpp, framework, dpdk, tcp, linux",Programming Languages and Development Tools,"high performance, tcp, app development, network, framework"
166,Software and Computational Systems Lab at LMU Munich,"Software Analysis, Software Verification, and Benchmarking","java, python,  javascript",Programming Languages and Development Tools,"software analysis, software verification, benchmarking, smt solver"
167,Space @ Virginia Tech,Space@VT is devoted to the investigation of the space environment.,"python, javascript, d3, mysql, mongodb",Science and Medicine,"real time, web, data visualization, data analytics"
168,SPDX,Promoting open source compliance through standard communication of SW licenses.,"rdf,  python,  java, json",Programming Languages and Development Tools,"compliance, open source, licensing"
169,Stemformatics,Stemformatics is a web-based pocket dictionary for stem cell scientists.,"python, javascript, postgresql",Science and Medicine,"web applications, cloud, bioinformatics"
170,STE||AR Group,HPX: The C++ Standard Library for Parallelism and Concurrency,"c++, cuda, opencv, python, boost",Programming Languages and Development Tools,"hpc, parallel algorithms, runtime systems, distributed datastructures, asynchronous many task systems"
171,Stony Brook University Biomedical Informatics,Advance biomedical knowledge through innovative data science research,"python, matlab, c++, javascript",Science and Medicine,"biomedical data science, cancer informatics, deep learning, medical imaging"
172,strace,linux syscall tracer,"linux, c, git, shell script, make",Operating Systems,"diagnostic, debugging, tracing"
173,Streetmix,"Design, remix, and share your neighborhood street, all in your browser.","javascript, react, redux, postgresql, mongodb",End User Applications,"smart cities, web, civic tech"
174,Submitty,Programming assignment submission with automated grading and manual TA grading,"python, c++, databases, web/html/css, php/javascript/ajax",Other,"education, privacy/security, data visualization, web"
175,Sugar Labs,"We make tools that learners use to explore, discover, create, and reflect.","python, javascript, gtk+",Other,"education, games, user interface, media, stem"
176,Sustainable Computing Research Group (SCoRe),"SCoRe has conducted research covering various aspects of Security, Mobile & IOT.","android, java, go, node, pyth",Web,"iot, web, mobile, machine learning, security"
177,Swift,Swift is a high-performance system programming language.,"c++, llvm,  cmake, swift",Programming Languages and Development Tools,"compilers, programming languages"
178,SymPy,SymPy is a Python library for symbolic mathematics.,python,Science and Medicine,"mathematics, computer algebra"
179,Systers Community,Helping women find their potential in code. You are not alone.,"ios, android, python, ruby on rails, javascript",Other,"mobile applications,  web apps, community"
180,TEAMMATES @ National University of Singapore,An online feedback management system for education," java, appengine, javascript",Web,"education, teaching, cloud, web applications"
181,The Center for Connected Learning and Computer-Based Modeling,NetLogo: A language and IDE for programming and scientific simulations," javascript, scala, html5/css3",Programming Languages and Development Tools,"simulation, education, programming language, science, academic research"
182,The Eclipse Foundation,An amazing open source community of diverse technology and collaboration.,"php,  java, xtext, javascript, c/c++",Other,"research, industry, internet of things, runtime systems"
183,The Honeynet Project,The Honeynet Project - R&D for Honeypot/Honeynet Technology and InfoSec Research,"python 3,  python, golang, c/c++, machine learning",Security,"honeypots, malware, sandbox, deception, networking"
184,The Java Pathfinder Team,JPF is a highly extensible Java virtual machine built for software verification,"java, jvm, android, distributed systems",Programming Languages and Development Tools,"program analysis, model checking, symbolic execution, test input generation, formal methods"
185,The Libreswan Project,Encrypting the Internet with IKE and IPsec,"c, python,  shell script, qemu",Security,ipsec vpn
186,The Linux Foundation,A non-profit consortium dedicated to fostering the growth of Linux,"c, c++, cups, ipp",Operating Systems,"kernel, printing, wireless, lsb, spdx"
187,The MacPorts Project,Open Source package manager for macOS,"tcl, html/javascript, frontend, vue.js, react.js",End User Applications,"package manager, mac os x, macos, command line, build tools"
188,The Mifos Initiative,End Poverty One Line of Code at a Time,"java, android, spring, angularjs, mysql",End User Applications,"fintech, financial inclusion, mobile banking, digital financial services, microfinance"
189,The NetBSD Foundation,Of course it runs NetBSD,"c, bsd make",Operating Systems,"kernel, userland, unix, packaging, bsd"
190,The ns-3 Network Simulator Project,ns-3 is a packet-level network simulator for research and education.,"c/c++,  python",Other,"networking, research and development, network simulation"
191,The Processing Foundation,Our goal is to empower people of all backgrounds to learn how to program.,"java, javascript, python, android, opengl",Programming Languages and Development Tools,"creative coding, graphics, design, education, web"
192,The Qt Project,The Qt Project co-ordinates the development of the Qt software framework.,"c++11, cpp, qt, qml, opengl",Programming Languages and Development Tools,"graphics, gis, maps, declarative language"
193,The syslog-ng project.,Open source log management solution with over a million users worldwide.,"java, c/c++, big data, elasticsearch, rest",Security,"logging, log management, message queue, python"
194,The Vega Visualization Tools by the UW Interactive Data Lab,"Declarative formats & Applications for Creating, Saving & Sharing Visualizations","javascript, typescript, react, d3.js",Data and Databases,"data visualization, visualization grammar, data science, declarative language, plotting tools"
195,The Wine Project,"Wine runs Windows applications on Linux, BSD, Solaris, macOS and Android."," directx,  x11,  win32, opengl, c",Other,"compatibility, desktop integration, 3d, directx, opengl"
196,TimVideos.us,"Software+hardware for recording & streaming conferences, meetings, user groups.","fpga, verilog, python, c",Graphics / Video / Audio / Virtual Reality,hardware
197,TLA+,"TLA+ is a formal specification language used to design, model and verify systems","java, tla+, eclipse, ocaml, smt",Programming Languages and Development Tools,"formal methods, algorithms"
198,UCSC Xena,Helping biologists see the bigger picture in diverse cancer genomics data," javascript, python, clojure, react, jvm",Science and Medicine,"bioinformatics, data visualization, web applications, cancer, genomics"
199,VideoLAN,Open Source Multimedia everywhere,"c, c++, go, vue.js",Graphics / Video / Audio / Virtual Reality,"multimedia, audio, video, 3d, vr"
200,ViSP,Visual tracking and visual servoing library,c/c++,Graphics / Video / Audio / Virtual Reality,"robotics, computer vision"
201,vitrivr,vitrivr - the open-source multimedia search engine,"java, angularjs, spark, grpc",Data and Databases,"retrieval, multimedia, video, audio, 3d"
202,webpack,webpack is THE build tool for modern web applications run on NodeJS,"javascript, web development, html5/css3, node.js, webassembly",Programming Languages and Development Tools,"tooling, toolchains, compilers, parser, web performance"
203,Wikimedia Foundation,Global movement whose mission is to bring free educational content to the world,"php, javascript, ruby on rails, android, reactjs",Web,"wikipedia, wikimedia, mediawiki, web, education"
204,WorldBrain.io - Verifying the Internet,Bookmarking extension that works like your brain - full-text search everything.,"react, javascript, browser extension, datproject",End User Applications,"search, fake-news, decentralization, misinformation, bookmarking"
205,X.org Foundation,"X Window System and related projects (Mesa, DRI, Wayland, etc.)","opengl, vulkan, x11, wayland, opencl",Graphics / Video / Audio / Virtual Reality,"graphic stack, 3d acceleration, 2d acceleration, media acceleration, windowing system"
206,Xapian Search Engine Library,"Fast, scalable and flexible search","c++, unicode, swig, linux, golang",Data and Databases,"search, information retrieval, machine learning, linguistics, indexing"
207,XBMC Foundation,The ultimate entertainment center,"python, c/c++, github, mysql",Graphics / Video / Audio / Virtual Reality,"home theater, audio, video"
208,Xi Editor Project,A modern text editor with a backend written in Rust.,"rust, swift",End User Applications,"text editing, ide"
209,xpra.org,"Screen for X11, remote desktop platform.","python, javascript, compression, remote access, cython",End User Applications,"graphics, remote access"
210,XWiki,The Advanced Open Source Enterprise Wiki," java, javascript, html5, css3, velocity",Web,"web development, wiki, platform, web applications, structured data"
211,Zulip,"Powerful, modern, open source team chat, complete with apps for every platform.","python, django, javascript, react native, electron",Social / Communications,"web development, team chat, mobile applications, visual design"
