,Organizations,About,Technology,Category,Topics
0,3DTK,The 3D Toolkit provides algorithms and methods to process 3D point clouds,"c/c++,  cmake, opencv, ros, boost",Science and Medicine," 3d, point clouds, slam, robotics, mapping"
1,52° North Initiative for Geospatial Open Source Software GmbH,52°North works on innovative ideas and technologies in geoinformatics,"javascript,  java, spring, r, big data",Science and Medicine,"geoinformatics, geoprocessing, remote sensing, geostatistics, sensor web"
2,AerospaceResearch.net,making space together,"python, c/c++, vhdl, boinc,  java",Science and Medicine,"cubesats, space applications, software defined radio, distributed computing, simulations"
3,aimacode,"Code for the book ""Artificial Intelligence: A Modern Approach"""," python,  java,  javascript, ai, jupyter",Programming Languages and Development Tools,"artificial intelligence, machine learning, education"
4,Amahi,"Amahi, a home digital assistant at your fingertips.","ruby on rails, golang, swift, javascript, android",Operating Systems,"media server, storage server, streaming,  web apps, front-end"
5,AOSSIE - Australian Open Source Software Innovation and Education,Australian Umbrella Org for Open-Source Projects,"scala, isabelle proof assistant, browser extension, javascript/html5/css3, android/ios",Web,"logic, electronic voting, philosophy, environment, natural language processing"
6,Apache Software Foundation,Providing open source software to the public free of charge,"c, java, erlang",Other,"other, cloud, libraries, big data"
7,Apertium,A free/open-source platform for machine translation and language technology,"c++, python, xml, fsts",Other,"machine translation, language technology, grammar, natural language processing"
8,Apertus Association,Open Technology for Professional Film Production,"fpga, embedded, linux, c/c++, vhdl",Graphics / Video / Audio / Virtual Reality,"vision, camera, cinematography, digital imaging, photography"
9,appleseedhq,A modern open source rendering engine for animation and visual effects,"c/c++, qt",Graphics / Video / Audio / Virtual Reality,"graphics, rendering, physics, mathematics, high performance"
10,ArduPilot,The worlds most advanced open source autopilot,"drones, python, linux, c/c++, robotics",End User Applications,"vision, robotics, embedded systems, real-time os, drones"
11,BeagleBoard.org Foundation,Open hardware and software for physical computing,"linux, gcc, real-time, physical computing, iot",Programming Languages and Development Tools,"robotics, ros, audio, iot, interfaces"
12,Beam Community,"From distributed systems, to robust servers and language design on the Erlang VM","erlang, xmpp",Programming Languages and Development Tools,"distributed computing, real time, distributed databases, iot, instant messaging"
13,BeeWare Project,Tools for cross-platform Python application development.,"python, ios, android, javascript,  java",Programming Languages and Development Tools,"mobile, cross desktop, app development"
14,Berkman Klein Center for Internet & Society at Harvard University,"Exploring cyberspace, sharing in its study, and helping pioneer its development.","ruby on rails, meteor.js, elasticsearch, javascript, elk",Other," web,  research, education, internet freedom, internet censorship"
15,Blender Foundation,We build a free and open source 3D creation suite.,"c, c++, python, opengl, opencl",Graphics / Video / Audio / Virtual Reality,"animation, rendering, 3d, games, simulation"
16,Boost C++ Libraries,Boost provides free peer-reviewed portable C++ source libraries,"c++11, c++14, c++, c++17",Programming Languages and Development Tools,"c++ development, c++ tools, c++ standardization, software engineering"
17,Boston University / XIA,Crowdsourcing the future Internet,"xia, linux kernel, c, advanced data structures,  ddos",Cloud,"computer networking, future internet architecture, research"
18,BRL-CAD,"Solid modeling, 3D printing, comp. graphics, & other computer-aided tech (CAx)!","c/c++, qt, opengl, opencl, tcl/tk",Graphics / Video / Audio / Virtual Reality,"cad, geometry, 3d, graphics user interface, software visualization"
19,Canadian Centre for Computational Genomics,Analytical solutions for Next-Generation Sequencing data,"r, perl, awk, bash, python",Science and Medicine,"bioinformatics, data science, next-generation sequencing, visualization, statistics"
20,Catrobat,Computational Thinking for all through visual programming on phones,"java, android, ios, espresso",Programming Languages and Development Tools,"programming language, app development, education, scratch"
21,CCExtractor Development,"Experimenting with video software and hardware, subtitles, imaging, cloud...","c, python, arduino, node.js, c#",Graphics / Video / Audio / Virtual Reality,"media, subtitles, video, accesibility, language"
22,Center for Research In Open Source Software (CROSS) at UC Santa Cruz,Bridging the Gap Between Student Work and Open Source Software Projects,"ceph, hadoop, c++, javascript,  python",Other,"distributed networks, reproducibility, storage systems, big data, opendata"
23,CERN-HSF,Umbrella organization for Particle (High-energy) Physics-related projects,"c/c++, python, data analysis, machine learning, parallelization",Science and Medicine,"particle physics, high-energy physics, physics, big data, machine learning"
24,CGAL Project,C++ library of computational geometry and geometry processing,"c++, github, git",Science and Medicine,"computational geometry, geometry, mesh processing, arrangement, webhook"
25,CHAOSS: Community Health Analytics Open Source Software,Advacing open source project health and sustainability,"python 3,  javascript",End User Applications,"data visualization, visualization, machine learning"
26,Checker Framework,"Preventing programming errors before they happen, via easy-to-use verification",java,Programming Languages and Development Tools,"programmer productivity, software engineering, verification, bug finding"
27,CiviCRM LLC,"Build, engage and organize your constituents","php, mysql, angularjs, d3.js",End User Applications,"civil society, contacts&calendar sync"
28,Classical Language Toolkit,NLP for the Ancient World," python,  javascript",Other,"natural language processing,  web"
29,"CLiPS, University of Antwerp",Computational (Psycho)Linguistics,"python, javascript, mongodb",Data and Databases,"natural language processing, machine learning, artificial intelligence, text analytics, text generation"
30,Cloud Native Computing Foundation (CNCF),Sustaining open source cloud native projects like Kubernetes and Prometheus,"kubernetes, prometheus, grpc, docker, golang",Cloud,"cloud, container, monitoring, logging"
31,CloudCV,Building platforms for reproducible AI research,"machine learning, deep learning, computer vision, artificial intelligence, cloud",Cloud,"python,  tensorflow,  django,  angularjs,  react"
32,coala,Linting and Fixing Code for All Languages,"django, python 3, antlr, emberjs, reactjs",Programming Languages and Development Tools,"code analysis, chatops, devops, language server, dependency management"
33,Computational Biology @ University of Nebraska-Lincoln,"Further knowledge in health through computation, data visualization and analysis","javascript, webgl, reactjs, flask",Science and Medicine,"biological networks, bioinformatics, network simulation, computational biology, omics data"
34,Conversations.im,An open source instant messaging client and ecosystem based on Jabber & XMPP,"java, android, xmpp, gtk, javascript",Social / Communications,"instant messaging, mobile, desktop, web"
35,Cuneiform Digital Library Initiative,International digital library of artifacts inscribed with cuneiform writing,"python, mariadb, rdf, php, nltk",Data and Databases,"natural language processing, machine translation, information retrieval, linguistics, semantic web"
36,DBpedia,"An Open Platform for a Large, Multilingual, Semantic Knowledge Graph","rdf, scala, sparql",Data and Databases,"knowledge graph, data extraction, data analytics"
37,Debian Project,the universal operating system,"javascript,  ruby,  java,  python, c/c++",Operating Systems,"operating system, packaging, applications, community, communications"
38,Developers Italia,An open community digital public services developers,"python, ruby, node.js,  java, c/c++",Other,"government, open data, identity, data-science"
39,Digital Impact Alliance,Supporting open source projects for a digital society that serves everyone.,"android, java, php,  python,  javascript",End User Applications,"humanitarian, international, social good, charity, health"
40,Django Software Foundation,The web framework for perfectionists with deadlines.,"python, django",Web,"web development, web, web applications"
41,Drupal,"Drupal is a Free, Open, Modular CMS written in PHP. Let's make something amazing","web, web development, content management system, cms, object-oriented",Web,"php, symfony, sql, javascript, drupal 8"
42,Earth Science Information Partners (ESIP),Making Earth science data matter.," kubernetes,  dask,  xarray,  python, javascript",Data and Databases,"earth data, semantics, discovery, data visualization, earth science"
43,Elastic,"We are the creators of Elasticsearch, Kibana, Beats, and Logstash."," java, golang, node.js, react, jruby",Data and Databases,"data analytics, data visualization, monitoring, search, logging"
44,Eta,Eta is a dialect of Haskell on the Java Virtual Machine.,"haskell, jvm,  java",Programming Languages and Development Tools,"functional-programming, runtime systems, compilers, programming-tools"
45,Fedora Project,"Fedora Linux is built on the foundations of Freedom, Friends, Features, & First","linux, python, git, postgresql, ansible",Operating Systems,"linux distribution, desktop, community, web development, server"
46,FFmpeg,"A complete, cross-platform solution to record, convert & stream audio and video.","c, asm, git",Graphics / Video / Audio / Virtual Reality,"audio, video, multimedia, subtitles"
47,FOSSASIA,Improve People's Lives,"java, javascript, python, android, artificial intelligence",Web,"web development, artificial intelligence, personal assistants"
48,FOSSology,Open Source License Compliance by Open Source Software,"php, postgresql, lamp, linux, c/c++",Other,"licensing, open source, license compliance, compliance, spdx"
49,Free and Open Source Silicon Foundation,"The home for open source hardware, EDA tools and the related ecosystem","fpga, verilog, c, chisel, synthesis",Other,"open hardware, debugging, eda tools, web community"
50,Free UK Genealogy,Human transcription of family history data,"mongodb, ruby on rails, mysql, python,  css/html",Data and Databases,"ai, machine learning,  ui/ux,  web apps, open data"
51,FreeBSD,FreeBSD: The Foundation of the Internet,"c/c++, llvm,  shell script, assembly, make",Operating Systems,"virtualization,  kernel, cloud, embedded systems, security"
52,FreeType,A software library to render fonts.,"c, gnu make, gnu autotools, python, fonts",Graphics / Video / Audio / Virtual Reality,"fonts, truetype, opentype, graphics, rendering"
53,freifunk,Freifunk is a non-commercial initiative for free and open wireless networks.,"openwrt, javascript, html, c,  python",Social / Communications,"network, wireless, web applications,  embedded systems, software-defined networking"
54,"Genes, Genomes and Variation",Genomic sequence and annotation databases and browsers,"perl, mysql, java script",Science and Medicine,"data visualization, genomics, database, bioinformatics"
55,GENIVI Alliance,Developing open software for IVI and the connected car.,"yocto, c/c++, java",Operating Systems,"automotive, diagnostics, functional safety, middleware"
56,Gentoo Foundation,"A flexible, source-based Linux distribution."," shell script, bash, c/c++,  python, linux",Operating Systems,"operating systems, package management, embedded systems, security, init systems"
57,GFOSS - Open Technologies Alliance,Promote Openness with the use and development of Open Standards & Open Source.,"python 3, php/javascript/html,  css/html, java, c/c++",Other,"python, gtk, java jsp, c++ tools, javascript"
58,Git,"Fast, scalable, distributed revision control system","c,  shell script,  git",Programming Languages and Development Tools,"version control, dvcs"
59,Global Alliance for Genomics and Health,We develop open standards and tools for genomics to benefit human health.,"java, python, cloud, c/c++, mongodb",Science and Medicine,"genomics, genetics, standards, bioinformatics, web"
60,GNOME,A free desktop environment for GNU/Linux.,"c, python,  javascript, gtk+, gobject",Operating Systems,"desktop, applications, end user applications, operating system"
61,GNSS-SDR,An open source Global Navigation Satellite Systems software-defined receiver,"c/c++, gnss, c++11, c++14",Science and Medicine,"gnss, navigation, digital signal processing, software defined radio, communications engineering"
62,GNU Compiler Collection (GCC),GCC,"c++, c, openmp",Programming Languages and Development Tools,compilers
63,GNU Octave,Free Your Numbers,"c++, hg",Programming Languages and Development Tools,"mathematics, numerical computation, matlab, scientific computing, numerical methods"
64,GNU Project,GNU is an operating system that is free software,"c, lisp, python",Operating Systems,"free software, operating system"
65,GNU Radio,The free & open software radio ecosystem,"c++, python, simd, qt",End User Applications,"software defined radio, real-time, communications engineering, cybersecurity, dsp"
66,Godot Engine,Godot is a multi-platform 2D and 3D game engine with a feature-rich editor,"c++, cpp, opengl, github, crossplatform",Graphics / Video / Audio / Virtual Reality,"game engine, gaming, game development, rendering, virtual reality"
67,gRPC,"A high performance, open-source universal RPC framework","grpc, microservices, distributed systems, cloud",Cloud,"microservices, communications, distributed networks, infrastructure, middleware"
68,Haiku,Integrated operating system for personal computers,"c++, webkit, ffmpeg, posix, bsd unix",Operating Systems,"desktop, network, kernel, graphics, media"
69,Haskell.org,"Standardized, statically typed, lazy functional programming language",haskell,Programming Languages and Development Tools,"functional-programming, programming languages"
70,Homebrew,"An open source, console package manager for macOS","ruby, git, macos, rspec, bash",Programming Languages and Development Tools,"package managers, macos, terminal applications, github"
71,INCF,Advancing global collaborative brain research,"python, c/c++, javascript, cuda, xml",Science and Medicine,"neuroscience, big data, brain simulation, brain imaging, visualization"
72,Inclusive Design Institute,The IDI addresses the challenge of designing ICT to work for all potential users,"javascript, html, css, node.js, php",End User Applications,"accessibility, inclusivity, web, web applications, web development"
73,Inkscape,"Inkscape is a professional vector graphics editor for Windows, Mac OSX, & Linux.","svg, css, c++11,  python, gtk+",Graphics / Video / Audio / Virtual Reality,"graphics, web, geometry"
74,Inria Foundation,SOFA is an efficient simulation engine for research in medical simulation.,"c/c++, qt, webassembly, asm, communication protocol",Science and Medicine,"medical simulation, medical research, physics, real-time, scientific computing"
75,Institute for Artificial Intelligence,Research in Artificial Intelligence for Autonomous Mobile Robots,"c++, python, ros, unreal engine, lisp",Science and Medicine,"artificial intelligence, robotics, simulation, unreal engine, perception"
76,Intel Media And Audio For Linux,"Open Source Media libraries, Applications,  User space driver and Specification.","video, codecs, hardware acceleration, va-api, c",Graphics / Video / Audio / Virtual Reality,"video decode, video encode, video post processing, hardware accelerated media processing, video apis"
77,InterMine,"Integrating biological data sources, making it easy to query and analyse data","postgresql,  java,  javascript, python, clojure",Science and Medicine,"biology, genomics, data science, open science, bioinformatics"
78,Internet Archive,Universal Access to All Knowledge,"pthon, javascript",Web,"web extensions, voice apps, web archiving"
79,Internet Systems Consortium,We support critical internet infrastructure with quality open source,"dhcp, c/c++, mysql, cassandra, rest",Operating Systems,"networking, stateful, infrastructure, ipv6"
80,JBoss Community,Community of Java projects around JBoss Middleware," java, android, ios, opentracing, apache kafka",Programming Languages and Development Tools,"testing, cloud, mobile development, javaee, microservices"
81,JdeRobot - Universidad Rey Juan Carlos,A software framework for developing applications in robotics and computer vision,"ros, python, c++, gazebo, opencv",Other,"robotics, computer vision, robot simulator, teaching"
82,Jenkins project,Jenkins is an open-source automation server," java, groovy,  javascript",Programming Languages and Development Tools,"devops, development tools, continuous integration"
83,JGraphT,Java library that provides graph data-structures and algorithms.,java,Programming Languages and Development Tools,"graphs, algorithms, data structures, mathematics, network analysis"
84,Jitsi,The most innovative Open Source video conferencing community. Period.,"java, javascript, webrtc, react, react native",Social / Communications,"real time communications, web, video conferencing, networking, multimedia"
85,Joomla!,"Joomla, the flexible platform empowering website creators.","php,  javascript, mysql, html5/css3, cms",Web,"web, web development, web applications, cms, object-oriented"
86,JSK Robotics Laboratory / The University of Tokyo,JSK is focusing on the fundamental functions & systems for intelligent robots .,ros,Science and Medicine,robotics
87,KDE Community,Experience Freedom!,"qt, c/c++, qml",End User Applications,"applications, desktop environment"
88,Kiwix,Internet content for people without internet access,"android, java, c++, python, qt",End User Applications,"offline, android"
89,LabLua,Programming Languages Research with emphasis on the Lua language,"lua, céu",Programming Languages and Development Tools,programming languages
90,languagetool.org,Style and grammar checker,"java, javascript, machine learning, ai, tensorflow",End User Applications,"artificial intelligence, language, edtech, education, nlp"
91,LEAP Encryption Access Project,We make encryption easy to use.,"python, twisted, javascript, openvpn, gnupg",End User Applications,"e2e, mail, vpn, encryption"
92,LibreHealth,Healthcare for Humanity,"java, php,  javascript, mysql, webcomponents",Science and Medicine," web apps, health, ictd, medicine, global health"
93,LibreOffice,LibreOffice is the leading free and open source office suite.,"c++, java, python",End User Applications,"end user applications, office suite, desktop application, android"
94,libvirt,Toolkit to manage virtualization hosts from many languages,"hypervisor, kvm, xen, lxc",Cloud,"virtualization, virtual machine, container"
95,LLVM Compiler Infrastructure,LLVM Compiler Infrastructure,llvm,Programming Languages and Development Tools,"compilers, compiler api"
96,LuaRocks,The package manager for the Lua programming language,"lua, linux, windows, unix, c",Programming Languages and Development Tools,"programming language, package manager"
97,MariaDB Foundation,One of the most popular databases on the web with many notable users,"mariadb, mysql, c, c++, java",Data and Databases,"database, sql"
98,Matrix.org,"An ambitious open ecosystem for decentralised, encrypted communication.","golang, ios,  android,  python, react",Social / Communications,"real time communications, team chat, voip, instant messaging, decentralization"
99,MetaBrainz Foundation Inc.,Curating open data sets with open source softer and loads of volunteers.,"python, perl, javascript, postgresql, react",Data and Databases,"music, metadata, big data, community"
100,Metasploit,The world’s most used penetration testing framework,"ruby, postgresql, python, c, assembly",Security,"security, penetration testing, offensive security, exploitation"
101,Mixxx DJ Software,"DJ Your Way, For Free. Join our friendly community of hackers, DJs, and artists!","qt, audio, music, real-time, c++",Graphics / Video / Audio / Virtual Reality,"beatdetection, metadata"
102,mlpack,a scalable C++ machine learning library,c++,Data and Databases,"machine learning, deep learning, algorithms, data science"
103,Mobile Robot Programming Toolkit (MRPT),Empowering C++ development in robotics,"c/c++, cmake, python, webs",Science and Medicine,"robot, ai, computer vision, real-time, slam"
104,Moodle,Empowering educators to improve our world,"php,  javascript, ionic, sql, angular",Social / Communications,"education, web applications, e-learning, school system, learning management"
105,MovingBlocks,Terasology: like an open source Minecraft - imagine the possibilities!," java, opengl, json, blender, github",End User Applications,"game, voxel, minecraft, sandbox, modding"
106,Mozilla,"Internet for people, not profit.","javascript, c++, rust, python, css",Web,"open web, free software, web, browser"
107,MuseScore,"Create, play and print beautiful sheet music","qt, c++11, cpp, midi",Graphics / Video / Audio / Virtual Reality,"music, music notation, user interface, end user applications, sheet music"
108,National Resource for Network Biology (NRNB),Developing open source software to enable network-based biomedical discovery,"java, javascript, python, html, c/c++",Science and Medicine,"network analysis, biology, data visualization, data modeling, web applications"
109,Neovim,Vim-fork focused on extensibility and usability,"lua, c, vim, javascript,  python",Programming Languages and Development Tools,"text editor, vim, cross platform, tools"
110,Netfilter project,netfilter.org is the home of the Linux firewalling tools,"linux kernel, c",Operating Systems,"firewall, computer networking"
111,NumFOCUS,Open Code = Better Science,"python, julia, r, javascript, c++",Science and Medicine,"statistical computing, machine learning, high performance computing, big data, data visualization"
112,omegaUp.com,omegaUp is aimed to increase the number of talented Software Engineers in LatAm.,"php, mysql,  python",Web,"cs education, education, web community"
113,Open Bioinformatics Foundation,Promoting practice & philosophy of OSS & Open Science in biological research.,"python,  javascript, d, php, c/c++",Science and Medicine,"computational biology, bioinformatics,  web"
114,Open Chemistry,Advancing Open Source and Open Science for Chemistry,"python, c++, javascript,  java, opengl",Science and Medicine,"science, data science, visualization, chemistry"
115,Open Data Kit,Open Data Kit is used to collect data for social good in difficult environments.," android,  java",End User Applications,"mobile, global development, global health, social good"
116,Open Food Facts,"A collaborative, free and open database of food and cosmetic products.","perl, mongodb, ios, android, machine learning",Science and Medicine,"computer vision, crowdsourcing, open data, food, health"
117,Open Roberta Lab,Open Roberta® Lab is an online IDE introducing kids to program robots with NEPO®,"java, javascript",Web,"education, programming, robotics"
118,Open Source Robotics Foundation,Our mission is to support the development of OSS for use in robotics,"c/c++, python, javascript, ros, gazebo",Programming Languages and Development Tools,robotics
119,Open States,Open Source State Legislative Data,"python, django, react, graphql, postgresql",Other,"civic tech, scraping, web, government"
120,OpenAstronomy,Opening the eyes of research astronomy software to the whole world.,"python, julia, c++, numba",Science and Medicine,"visualization, astronomy, solar physics, orbital mechanics, high-energy astrophysics"
121,OpenCensus,Planet Scale Tracing and Monitoring,"python, java, ruby, node, go",Cloud,"tracing, monitoring, c++, php"
122,OpenMRS,Write code. Save lives.," java, spring, javascript, rest, mysql",Science and Medicine,"open source, medical records, developing countries"
123,OpenSIPS,"A multi-purpose Open Source SIP proxy/server for carriers, telecoms or ITSPs","c,  python, mysql, scripting",Social / Communications,"voip, telephony, real-time-communications, sip"
124,OpenStreetMap,Creating and distributing free geographic data for the world.,"postgis,  java,  ruby,  javascript, c/c++",Data and Databases,"gis, maps, crowdsourcing, geoinformatics"
125,openSUSE,"The makers' choice for sysadmins, developers and desktop users.","ruby on rail, perl,  ruby, html/javascript, c/c++",Operating Systems," web, qa, packaging,  ui/ux"
126,OpenWISP,Open Source solution to build and manage wifi networks,"python, django, javascript, openwrt, linux",Web,"wifi, mesh-networks, wireless, networking, web development"
127,OpnTec,Developing Open Event Solutions for Everyone,"python, javascript, emberjs, cloud, android",Social / Communications,"open event, event solutions, web"
128,Oppia Foundation,"Adaptive, enjoyable learning experiences that provide personalized feedback.","angularjs, python,  javascript, appengine,  css",Web,"education, web, interactive, tools, community"
129,OSGeo,The Open Source Geospatial Foundation,"c/c++, standards, python, sql, database",Other,"mapping, gis, geospatial, citizen science, open science"
130,OW2,The open source community for infrastructure software.,"java, perl, middleware, bpm, wiki",Other,"enterprise information systems, cloud, security, middleware"
131,OWASP Foundation,"OWASP, The Open Web Application Security Project.","java, net, ruby, javascript, python",Security,"application security, cloud security, mobile security"
